{
  "songId": 10001,
  "version": 1,
  "enabled": true,
  "title": "Hello, SEKAI",
  "artist": "DECO*27",
  "bpm": 148,
  "genre": "",
  "tags": [],
  "media": {
    "audio": {
      "url": "https://raw.githubusercontent.com/TerasGroup/VRChat_MaiSongs/main/media/audio/10001.mp3",
      "path": "media/audio/10001.mp3",
      "preload": {
        "path": "media/preload/10001.wav"
      }
    },
    "background": {
      "type": "image",
      "url": "https://raw.githubusercontent.com/TerasGroup/VRChat_MaiSongs/main/media/backgrounds/10001.jpg",
      "path": "media/backgrounds/10001.jpg"
    }
  },
  "charts": {
    "5": {
      "chartId": 100015,
      "level": "13",
      "designer": "MiraT",
      "version": 1
    }
  },
  "runtimeSlot": 0
}
